id,Company Name,Date,Text
276,ADTRAN INC,2 January 2004,"ADTRAN, Inc. to Present at The Sixth Annual Needham Growth Conference"
277,ADTRAN INC,5 January 2004,"ADTRAN, Inc. Reports Revenue and Earnings Estimates for Fourth Quarter 2003"
278,ADTRAN INC,8 January 2004,"Zacks Buy List Highlights: ACE Limited, Knight Trading Group, ADTRAN, and EMC Corporation"
279,ADTRAN INC,9 January 2004,"Zacks.com Announces That Bill Martin and Matt Ragas Highlight the Following Stocks: XO Communications, InterActiveCorp, Trikon Tech, Adtran..."
280,ADTRAN INC,20 January 2004,"ADTRAN, Inc. Reports Fourth Quarter 2003 Results and Declares Increased Quarterly Cash Dividend"
281,ADTRAN INC,27 January 2004,"ADTRAN, Inc. to Present at the Thomas Weisel Partners Annual Technology Conference, February 2, 2004"
282,ADTRAN INC,25 February 2004,"ADTRAN, Inc. to Present at the Raymond James 25th Annual Institutional Investors Conference, March 1, 2004"
283,ADTRAN INC,27 February 2004,"Zacks Buy List Highlights: ADTRAN, StorageTek, Cognizant, and OmniVision Technologies"
284,ADTRAN INC,2 March 2004,"ADTRAN, Inc. to Present at the Deutsche Bank 2004 Global Information Technology Hardware Conference, March 8, 2004"
285,ADTRAN INC,8 March 2004,"ADTRAN Adds VoIP Capability to Market-leading IADs; Product Enhancements Allow Carriers to Offer IP Services, Such as Hosted PBX, Without..."
286,ADTRAN INC,10 March 2004,"ADTRAN, Inc. to Present at the 2004 Merrill Lynch Communications Investor Conference, March 16, 2004"
287,ADTRAN INC,12 March 2004,ADTRAN Announces DSLAM Deployments at Qwest; Total Access 1100 OSP DSLAMs Used for Outside Plant Deployment
288,ADTRAN INC,16 March 2004,Frontier Selects Adtran's Total Access System for ADSL Delivery; Total Access DSLAMs Will Expand Broadband Services Throughout The Frontier...
289,ADTRAN INC,17 March 2004,ADTRAN Redefines Internet Security Appliances -- Simplifying the Task of Securing Corporate Networks; Next Generation NetVanta 2000 Series...
290,ADTRAN INC,30 March 2004,ADTRAN Enhances NetVanta Access Routers For VoIP Applications; New ADTRAN OS Adds QoS for Traffic Prioritization and Bandwidth Efficiency
291,ADTRAN INC,5 April 2004,"ADTRAN, Inc. to Release First Quarter Earnings on April 14, 2004"
292,ADTRAN INC,9 April 2004,"Stock Market Ratings by StockPickReport.com for Sanmina-SCI Corporation, Genentech Inc., Biomet Inc., ADTRAN Inc. and Boise Cascade..."
293,ADTRAN INC,13 April 2004,ADTRAN All-In-One Network Access Solution Redefines Branch Office Connectivity
294,ADTRAN INC,13 April 2004,"ADTRAN, Inc. Reports First Quarter 2004 Results and Declares Quarterly Cash Dividend"
295,ADTRAN INC,13 April 2004,ADTRAN Ethernet Switches Complete WAN-to-the-Desktop Solution; New NetVanta Product Line Provides Managed Layer 2 Connectivity
296,ADTRAN INC,16 April 2004,"Stock Market Ratings by StockPickReport.com for Sanmina-SCI, Genentech, Biomet, ADTRAN and Boise Cascade"
297,ADTRAN INC,29 April 2004,"ADTRAN, Inc. to Present at the 32nd Annual JPMorgan Technology Conference, May 5, 2004"
298,ADTRAN INC,29 April 2004,"ADTRAN, Inc. Announces Four Million Share Repurchase Plan"
299,ADTRAN INC,30 April 2004,"Stock Market Ratings by StockPickReport.com for Sanmina-SCI, Genentech, Biomet Inc, ADTRAN, Boise Cascade Corp"
300,ADTRAN INC,11 May 2004,ADTRAN Expands Access Router Offering With Dual T3 Solution; NetVanta 5305 Makes Higher Bandwidth Applications More Affordable For Small and...
